{
  "schema_version": "1",
  "event_id": "6b30ff6bbbc953e840c408af2d44f1d8",
  "traceparent": "00-6b30ff6bbbc953e840c408af2d44f1d8-d102748ae840e5cd-01",
  "ts": "2026-11-18T14:02:11Z",
  "cluster": "worker-a",
  "az": "ap-northeast-2a",
  "node": "ip-10-0-1-23",
  "gpu_uuid": "GPU-b850f46d-d5ea-c752-ddf3-c4453e44d3f7",
  "job_id": "job-0421",
  "generation": 3,
  "source": "dmesg",
  "raw": {
    "xid": 63,
    "exit_code": null,
    "metric": null,
    "value": null,
    "log_line": "NVRM: Xid (PCI:0000:00:1e): 63, pid=12345, name=python, Dynamic Page Retirement: New page retired, reboot to activate (0x00000000000a8b2f)."
  },
  "correlated": [],
  "collector_healthy": true,
  "dedup_key": "GPU-b850f46d-d5ea-c752-ddf3-c4453e44d3f7|63|2026-11-18T14:02:11Z",
  "category": "hw_warn",
  "confidence": 0.9,
  "suggested_action": "none"
}
