{
  "schema_version": "1",
  "event_id": "8ec19ae4fd02ed3112f74c24928b6841",
  "traceparent": "00-8ec19ae4fd02ed3112f74c24928b6841-dc6486b4adbf3c2a-01",
  "ts": "2026-11-18T14:02:11Z",
  "cluster": "worker-a",
  "az": "ap-northeast-2a",
  "node": "ip-10-0-1-23",
  "gpu_uuid": "GPU-b850f46d-d5ea-c752-ddf3-c4453e44d3f7",
  "job_id": "job-0421",
  "generation": 3,
  "source": "straggler",
  "raw": {
    "xid": null,
    "exit_code": null,
    "metric": "training_step_seconds_p99_ratio",
    "value": 1.8,
    "log_line": null
  },
  "correlated": [
    {
      "alert": "GpuThrottleSustained",
      "source": "dcgm",
      "ts": "2026-11-18T14:00:30Z"
    }
  ],
  "collector_healthy": true,
  "dedup_key": "GPU-b850f46d-d5ea-c752-ddf3-c4453e44d3f7|straggler|2026-11-18T14:02:11Z",
  "category": "straggler",
  "confidence": 0.75,
  "suggested_action": "evacuate_preemptive"
}
